{
  "schema_version": "1.0",
  "binding_bundle_id": "go_binding_contract_20260513",
  "tool": {
    "name": "mchs-go-binding",
    "package": "go-binding",
    "entry_point": "contracts/go-binding"
  },
  "privacy": {
    "classification": "synthetic",
    "contains_phi": false,
    "notes": "Metadata-only Go binding contract. It describes request and response structs, transport fallback, diagnostics, provenance, errors, fixture gates, and module readiness without committing calculator logic or licensed payloads."
  },
  "public_calculator_contract": {
    "source_path": "microcosting_healthservices/nwau_py/contracts.py",
    "model_name": "CalculatorContract",
    "fields": [
      "schema_version",
      "calculator_id",
      "pricing_year",
      "input_schema_version",
      "output_schema_version",
      "required_input_columns",
      "required_output_columns"
    ],
    "supported_calculators": [
      "acute",
      "adjust",
      "community_mh",
      "ed",
      "mh",
      "outpatients",
      "subacute"
    ],
    "notes": "The Go binding request and response structs mirror the public calculator contract fields and only add transport metadata for service, CLI, and Arrow-file handoff."
  },
  "transport_modes": [
    {
      "mode": "service",
      "priority": "fallback",
      "notes": "Fallback path for callers that need online request/response behavior."
    },
    {
      "mode": "cli",
      "priority": "primary",
      "notes": "Process-bound primary path for batch or local execution."
    },
    {
      "mode": "arrow-file",
      "priority": "primary",
      "notes": "Inspectible file-exchange primary path for offline handoff using Arrow-compatible artifacts."
    }
  ],
  "request_structs": [
    {
      "name": "GoBindingRequest",
      "status": "stable",
      "fields": [
        {
          "name": "schema_version",
          "type": "string",
          "required": true,
          "modes": [
            "service",
            "cli",
            "arrow-file"
          ],
          "notes": "Binding schema version for the request envelope."
        },
        {
          "name": "calculator_id",
          "type": "string",
          "required": true,
          "modes": [
            "service",
            "cli",
            "arrow-file"
          ],
          "notes": "Public calculator identifier from the shared contract."
        },
        {
          "name": "pricing_year",
          "type": "string",
          "required": true,
          "modes": [
            "service",
            "cli",
            "arrow-file"
          ],
          "notes": "IHACPA pricing year or edition label."
        },
        {
          "name": "input_schema_version",
          "type": "string",
          "required": true,
          "modes": [
            "service",
            "cli",
            "arrow-file"
          ],
          "notes": "Version of the declared input schema expected by the calculator."
        },
        {
          "name": "output_schema_version",
          "type": "string",
          "required": true,
          "modes": [
            "service",
            "cli",
            "arrow-file"
          ],
          "notes": "Version of the declared output schema returned by the calculator."
        },
        {
          "name": "input_path",
          "type": "string",
          "required": false,
          "modes": [
            "cli",
            "arrow-file"
          ],
          "notes": "Local path for batch input when the binding uses a file boundary."
        },
        {
          "name": "output_path",
          "type": "string",
          "required": false,
          "modes": [
            "cli",
            "arrow-file"
          ],
          "notes": "Local path for batch output when the binding uses a file boundary."
        },
        {
          "name": "service_url",
          "type": "string",
          "required": false,
          "modes": [
            "service"
          ],
          "notes": "Configured service endpoint for the fallback transport path."
        },
        {
          "name": "arrow_input_path",
          "type": "string",
          "required": false,
          "modes": [
            "arrow-file"
          ],
          "notes": "Arrow-compatible input handoff path for the fallback path."
        },
        {
          "name": "arrow_output_path",
          "type": "string",
          "required": false,
          "modes": [
            "arrow-file"
          ],
          "notes": "Arrow-compatible output handoff path for the fallback path."
        },
        {
          "name": "correlation_id",
          "type": "string",
          "required": false,
          "modes": [
            "service",
            "cli",
            "arrow-file"
          ],
          "notes": "Traceable caller-provided request identifier."
        },
        {
          "name": "metadata",
          "type": "object",
          "required": false,
          "modes": [
            "service",
            "cli",
            "arrow-file"
          ],
          "notes": "Opaque caller metadata that must not carry calculator logic."
        },
        {
          "name": "fixture_gate",
          "type": "string",
          "required": true,
          "modes": [
            "service",
            "cli",
            "arrow-file"
          ],
          "notes": "Declared fixture gate for synthetic-only or local-only payload handling."
        }
      ],
      "notes": "Single versioned Go request envelope that mirrors the public calculator contract and adds only transport metadata."
    }
  ],
  "response_structs": [
    {
      "name": "GoBindingResponse",
      "status": "stable",
      "fields": [
        {
          "name": "schema_version",
          "type": "string",
          "required": true,
          "modes": [
            "service",
            "cli",
            "arrow-file"
          ],
          "notes": "Binding schema version for the response envelope."
        },
        {
          "name": "calculator_id",
          "type": "string",
          "required": true,
          "modes": [
            "service",
            "cli",
            "arrow-file"
          ],
          "notes": "Echoes the public calculator identifier."
        },
        {
          "name": "pricing_year",
          "type": "string",
          "required": true,
          "modes": [
            "service",
            "cli",
            "arrow-file"
          ],
          "notes": "Echoes the pricing year used during execution."
        },
        {
          "name": "mode",
          "type": "string",
          "required": true,
          "modes": [
            "service",
            "cli",
            "arrow-file"
          ],
          "notes": "Declares the transport path that produced the result."
        },
        {
          "name": "success",
          "type": "boolean",
          "required": true,
          "modes": [
            "service",
            "cli",
            "arrow-file"
          ],
          "notes": "True only when the request completed without a blocking error."
        },
        {
          "name": "status",
          "type": "string",
          "required": true,
          "modes": [
            "service",
            "cli",
            "arrow-file"
          ],
          "notes": "Machine-readable execution state for the caller."
        },
        {
          "name": "message",
          "type": "string",
          "required": true,
          "modes": [
            "service",
            "cli",
            "arrow-file"
          ],
          "notes": "Short human-readable summary of the result."
        },
        {
          "name": "warnings",
          "type": "array",
          "required": false,
          "modes": [
            "service",
            "cli",
            "arrow-file"
          ],
          "notes": "Non-blocking warnings attached to the response."
        },
        {
          "name": "errors",
          "type": "array",
          "required": false,
          "modes": [
            "service",
            "cli",
            "arrow-file"
          ],
          "notes": "Machine-readable error records emitted when the response does not succeed."
        },
        {
          "name": "diagnostics",
          "type": "object",
          "required": true,
          "modes": [
            "service",
            "cli",
            "arrow-file"
          ],
          "notes": "Structured diagnostic record with pass, fail, and blocked checks."
        },
        {
          "name": "provenance",
          "type": "object",
          "required": true,
          "modes": [
            "service",
            "cli",
            "arrow-file"
          ],
          "notes": "Provenance record for the request and any generated artifact."
        },
        {
          "name": "service_url",
          "type": "string",
          "required": false,
          "modes": [
            "service"
          ],
          "notes": "Service endpoint used to complete the request."
        },
        {
          "name": "output_path",
          "type": "string",
          "required": false,
          "modes": [
            "cli",
            "arrow-file"
          ],
          "notes": "Output path used by the fallback file boundary."
        },
        {
          "name": "arrow_output_path",
          "type": "string",
          "required": false,
          "modes": [
            "arrow-file"
          ],
          "notes": "Arrow-compatible output path used by the fallback file boundary."
        },
        {
          "name": "fixture_gate_state",
          "type": "string",
          "required": true,
          "modes": [
            "service",
            "cli",
            "arrow-file"
          ],
          "notes": "Observed fixture-gate outcome for the request."
        },
        {
          "name": "module_readiness_state",
          "type": "string",